{
  "$schema": "../../../schemas/unit_archetype.schema.json",
  "id": "infantry",
  "name": "Infantry",
  "description": "Standard melee combat unit. Forms the backbone of any army.",
  "category": "infantry",
  "tier": 1,
  "baseStats": {
    "health": 100,
    "healthRegen": 0.25,
    "mana": 0,
    "manaRegen": 0,
    "damage": 12,
    "damageVariance": 0.15,
    "attackSpeed": 1.2,
    "attackRange": 1,
    "armor": 2,
    "magicResist": 0,
    "moveSpeed": 5.0,
    "sightRange": 10,
    "critChance": 0.05,
    "critMultiplier": 1.5
  },
  "cost": {
    "gold": 75,
    "wood": 0,
    "food": 1,
    "stone": 0,
    "mana": 0
  },
  "abilities": [
    {
      "id": "shield_wall",
      "unlockedByDefault": false,
      "requiredLevel": 1
    }
  ],
  "canGather": false,
  "canBuild": false,
  "canRepair": false,
  "isHero": false,
  "isUnique": false,
  "requiredBuilding": "barracks",
  "requiredAge": 0,
  "populationCost": 1,
  "trainTime": 20,
  "bonusVs": [
    {
      "category": "cavalry",
      "multiplier": 1.25
    }
  ],
  "armorType": "medium",
  "attackType": "normal",
  "movementType": "ground",
  "upgrades": ["infantry_armor_1", "infantry_damage_1"],
  "visuals": {
    "model": "models/units/infantry.fbx",
    "portrait": "textures/portraits/infantry.png",
    "icon": "textures/icons/units/infantry.png",
    "scale": 1.0,
    "animations": {
      "idle": "anim_idle",
      "walk": "anim_walk",
      "attack": "anim_attack",
      "death": "anim_death",
      "special": "anim_shield_wall"
    }
  },
  "sounds": {
    "select": ["sounds/units/infantry/select1.wav", "sounds/units/infantry/select2.wav"],
    "move": ["sounds/units/infantry/move1.wav", "sounds/units/infantry/move2.wav"],
    "attack": ["sounds/units/infantry/attack1.wav", "sounds/units/infantry/attack2.wav"],
    "death": ["sounds/units/infantry/death1.wav"],
    "ready": ["sounds/units/infantry/ready.wav"]
  }
}
